steamid,appid,name,release_date,english,developer,publisher,platforms,required_age,categories,genres,steamspy_tags,achievements,positive_ratings,negative_ratings,average_playtime,median_playtime,owners,price,header_image,background,short_description
1332,209080,Guns of Icarus Online,2012-10-29,1,Muse Games,Muse Games,windows;mac;linux,0,Multi-player;Steam Achievements;Steam Trading Cards;Steam Workshop;Partial Controller Support;Stats,Action;Adventure;Indie;Simulation,Steampunk;Team-Based;Multiplayer,849,12932,1276,275,295,2000000-5000000,3.99,https://steamcdn-a.akamaihd.net/steam/apps/209080/header.jpg?t=1536787177,https://steamcdn-a.akamaihd.net/steam/apps/209080/page_bg_generated_v6b.jpg?t=1536787177,"Assemble your crew, take to the skies in the premier PvP airship combat game. Guns of Icarus Online is all about flying massive airships, shooting big turret weapons, and working as a team for supremacy of the skies. Everyone as one, victory or death, together."
1874,246090,Spacebase DF-9,2014-10-27,1,Double Fine Productions,Double Fine Productions,windows;mac;linux,0,Single-player;Steam Trading Cards;Steam Cloud,Indie;Simulation;Strategy,Simulation;Space;Sci-fi,0,741,3134,228,228,100000-200000,6.99,https://steamcdn-a.akamaihd.net/steam/apps/246090/header.jpg?t=1479171211,https://steamcdn-a.akamaihd.net/steam/apps/246090/page_bg_generated_v6b.jpg?t=1479171211,"In Spacebase DF-9, you'll build a home among the stars for a motley population of humans and aliens as they go about their daily lives. Mine asteroids, discover derelicts, and deal with the tribulations of galactic resettlement in Earth's distant future."
2823,286880,Disney Planes,2014-10-06,1,Behaviour Interactive,Disney Interactive,windows,0,Single-player;Shared/Split Screen;Steam Trading Cards;Partial Controller Support;Steam Cloud,Action;Adventure,Action;Adventure;Family Friendly,0,21,6,0,0,0-20000,15.49,https://steamcdn-a.akamaihd.net/steam/apps/286880/header.jpg?t=1542758787,https://steamcdn-a.akamaihd.net/steam/apps/286880/page_bg_generated_v6b.jpg?t=1542758787,"From above the world of “Cars”, Disney’s Planes takes players on a high-flying, action-packed animated comedy adventure with Dusty Crophopper, a big-hearted, speed-loving crop duster, voiced by actor and comedian Dane Cook. Embark on global missions and grand adventures around the world."
3743,318230,Convoy,2015-04-21,1,Convoy Games,Indietopia Games ,windows;mac;linux,0,Single-player;Steam Achievements;Steam Trading Cards,Action;Adventure;Indie;RPG;Strategy,Strategy;Pixel Graphics;Indie,29,813,212,77,77,100000-200000,9.99,https://steamcdn-a.akamaihd.net/steam/apps/318230/header.jpg?t=1545404123,https://steamcdn-a.akamaihd.net/steam/apps/318230/page_bg_generated_v6b.jpg?t=1545404123,"Convoy is a tactical roguelike-like inspired by Mad Max and FTL in which you cross a wasteland in search of parts for your broken ship. Presented in pixel art and set in a future post-apocalyptic setting, Convoy is a squad based tactical combat roguelike-like in its core."
25010,953610,HOT GIRLS VR,2018-10-26,1,tomimar,tomimar,windows,0,Single-player,Action;Adventure;Casual;Free to Play;Indie;Massively Multiplayer;Racing;RPG;Simulation;Sports;Strategy,Nudity;Sexual Content;Simulation,0,4,4,0,0,0-20000,9.29,https://steamcdn-a.akamaihd.net/steam/apps/953610/header.jpg?t=1543063208,https://steamcdn-a.akamaihd.net/steam/apps/953610/page_bg_generated_v6b.jpg?t=1543063208,"Welcome to the world full of beautiful, hot girls, meet them all, play with them at the party and... Do what you want. Everything depends on your imagination."
26515,1022610,Alchemic Dungeons DX,2019-02-14,1,Q-Cumber Factory,Flyhigh Works,windows,0,Single-player;Partial Controller Support,RPG,RPG;Rogue-like;Pixel Graphics,0,6,0,0,0,0-20000,5.79,https://steamcdn-a.akamaihd.net/steam/apps/1022610/header.jpg?t=1550153186,https://steamcdn-a.akamaihd.net/steam/apps/1022610/page_bg_generated_v6b.jpg?t=1550153186,"Blending rogue-like dungeon exploration with item crafting, Alchemic Dungeons DX is a game of endless variety!"
17361,713980,Mark After Dark,2017-12-14,1,Lesley Dodd,Lesley Dodd,windows,0,Single-player;Steam Achievements;Partial Controller Support,Sexual Content;Nudity;Indie;RPG;Simulation,Nudity;Sexual Content;RPG,18,5,0,0,0,0-20000,1.69,https://steamcdn-a.akamaihd.net/steam/apps/713980/header.jpg?t=1513323958,https://steamcdn-a.akamaihd.net/steam/apps/713980/page_bg_generated_v6b.jpg?t=1513323958,Mark really needs to get laid. Will you give him a happy ending?
11336,538060,Doodle God: 8-bit Mania - Collector's Item,2016-11-18,1,JoyBits Ltd.,JoyBits Ltd.,windows;mac;linux,0,Single-player;Steam Achievements;Steam Trading Cards;Steam Cloud;Steam Leaderboards,Casual;Indie;Simulation,Casual;Indie;Simulation,9,61,54,274,274,20000-50000,14.99,https://steamcdn-a.akamaihd.net/steam/apps/538060/header.jpg?t=1508513276,https://steamcdn-a.akamaihd.net/steam/apps/538060/page_bg_generated_v6b.jpg?t=1508513276,Every Element &amp; Reaction Have Been Beautifully Redrawn with this amazing 8-bit skin to original Doodle God. If You Loved Doodle God - try this unique version of one of the most original games in the world.
9757,495980,Selma and the Wisp,2016-08-04,1,Toucan Studio,Toucan Studio,windows;mac;linux,0,Single-player;Steam Achievements;Full controller support;Steam Cloud,Action;Adventure;Casual;Indie,Indie;Adventure;Casual,26,95,32,0,0,0-20000,6.99,https://steamcdn-a.akamaihd.net/steam/apps/495980/header.jpg?t=1513936798,https://steamcdn-a.akamaihd.net/steam/apps/495980/page_bg_generated_v6b.jpg?t=1513936798,"Selma and the Wisp is an astonishing platform game with a particularly eerie feel to it. Densely packed with logical puzzles and unexpected obstacles, the game incorporates innovative gameplay, low-poly models and an spectacular animations."
19254,769440,Beach Restaurant,2018-01-09,1,OnBlind,OnBlind,windows;mac;linux,0,Single-player;Steam Achievements,Casual;Indie;Simulation,Simulation;Indie;Casual,19,21,26,0,0,20000-50000,0.79,https://steamcdn-a.akamaihd.net/steam/apps/769440/header.jpg?t=1539904395,https://steamcdn-a.akamaihd.net/steam/apps/769440/page_bg_generated_v6b.jpg?t=1539904395,"Your task is to serve the orders of arriving tourists. Each order is unique, here you have a burger and cheeseburger, and soda and coffee."
7217,414740,RAID: World War II,2017-09-26,1,Lion game Lion,Starbreeze Publishing AB,windows,18,Single-player;Multi-player;Online Multi-Player;Co-op;Online Co-op;Steam Achievements;Steam Trading Cards;Partial Controller Support,Violent;Gore;Action;Adventure;RPG,Action;World War II;FPS,82,888,806,279,279,20000-50000,15.49,https://steamcdn-a.akamaihd.net/steam/apps/414740/header.jpg?t=1518429975,https://steamcdn-a.akamaihd.net/steam/apps/414740/page_bg_generated_v6b.jpg?t=1518429975,"RAID: World War II is an action-packed four player cooperative shooter set during a time when the Nazi war machine was still winning, and hope was in short supply."
3081,295850,Vlad the Impaler,2014-07-16,1,Section Studios,Section Studios,windows;mac,0,Single-player;Steam Achievements;Steam Trading Cards,Adventure;Casual;Indie;RPG,RPG;Visual Novel;Adventure,30,258,110,0,0,20000-50000,0.79,https://steamcdn-a.akamaihd.net/steam/apps/295850/header.jpg?t=1447361508,https://steamcdn-a.akamaihd.net/steam/apps/295850/page_bg_generated_v6b.jpg?t=1447361508,"A city gone mad with violence and the mass murder of its people. In this interactive graphic-novel, your choices can either lead you to the ultimate destruction of this fallen metropolis, or the demise of a vicious butcher. Will you save this city as promised or will you fall prey to the killer within?"
9480,488350,The Karters,2018-06-07,1,10Ants Hill,10Ants Hill,windows,0,Single-player;Multi-player;Online Multi-Player;Local Multi-Player;Shared/Split Screen;Partial Controller Support,Action;Indie;Racing;Early Access,Early Access;Racing;Indie,0,22,47,0,0,0-20000,15.49,https://steamcdn-a.akamaihd.net/steam/apps/488350/header.jpg?t=1528835916,https://steamcdn-a.akamaihd.net/steam/apps/488350/page_bg_generated_v6b.jpg?t=1528835916,"The Karters is an arcade karting game, inspired by Crash Team Racing’s gameplay, dynamics, and overall design. Compete and challenge your friends in a local or global multiplayer where only one can win. Pick one of the thrilling maps and try to find alternative routes to outsmart your rivals and get the gold!"
15291,658260,BLUE REFLECTION / BLUE REFLECTION　幻に舞う少女の剣,2017-09-26,1,"KOEI TECMO GAMES CO. LTD.","KOEI TECMO GAMES CO. LTD.",windows,0,Single-player;Steam Achievements;Partial Controller Support,RPG,RPG;Anime;Female Protagonist,47,356,84,0,0,0-20000,49.99,https://steamcdn-a.akamaihd.net/steam/apps/658260/header.jpg?t=1550186406,https://steamcdn-a.akamaihd.net/steam/apps/658260/page_bg_generated_v6b.jpg?t=1550186406,"A clear summer sky spreads over the Hoshinomiya Girls' High School. This story begins with the belated start of school life for Hinako Shirai, who has just recovered from a leg injury due to a tragic accident. The magical sisters Yuzu and Lime bestowed to her a special power to become a &quot;Reflector&quot;."
62,2520,Gumboy - Crazy Adventures™,2006-12-19,1,"CINEMAX s.r.o.","CINEMAX s.r.o.",windows,0,Single-player,Casual;Indie,Casual;Indie;Singleplayer,0,52,46,0,0,50000-100000,0.0,https://steamcdn-a.akamaihd.net/steam/apps/2520/header.jpg?t=1529320674,https://steamcdn-a.akamaihd.net/steam/apps/2520/page_bg_generated_v6b.jpg?t=1529320674,"Gumboy has fun and novel gameplay set in a richly imagined world. With simple game controls, Gumboy lets the player bounce, roll, float, and fly through the world. Additionally, Gumboy can change size, shape and material."
21032,819870,7 Days in Dream 光尘,2018-05-14,0,0Cube,0Cube,windows,0,Single-player;Partial Controller Support,Adventure;Casual;Indie;RPG;Simulation;Strategy,Adventure;RPG;Indie,0,30,1,0,0,0-20000,2.09,https://steamcdn-a.akamaihd.net/steam/apps/819870/header.jpg?t=1547467327,https://steamcdn-a.akamaihd.net/steam/apps/819870/page_bg_generated_v6b.jpg?t=1547467327,梦一场，爱一生 梦与现实间的7天里，真相与隐情逐渐浮出水面，再一次鼓起勇气拥抱爱！
24962,951420,Refraction,2019-02-19,1,Zilby,Zilby,windows;mac;linux,0,Single-player;Multi-player;Local Multi-Player;Co-op;Local Co-op;Shared/Split Screen;Steam Achievements;Full controller support;Steam Cloud;Steam Leaderboards,Action;Indie,Action;Indie,28,1,0,0,0,0-20000,2.89,https://steamcdn-a.akamaihd.net/steam/apps/951420/header.jpg?t=1550648902,https://steamcdn-a.akamaihd.net/steam/apps/951420/page_bg_generated_v6b.jpg?t=1550648902,"Refraction is a top-down, arena action game where you use quick reflexes to take down hordes of enemies. You must rely on your skill and your wit as you fight to survive, in the hope that you can live long enough to take down the core of all corruption."
2143,259340,Chicken Shoot Gold,2003-11-01,1,ToonTRAXX Studios,Topware Interactive,windows;mac,0,Single-player;Multi-player;Steam Trading Cards;Steam Cloud,Action;Casual;Indie,Action;Casual;Indie,0,139,108,326,301,100000-200000,4.99,https://steamcdn-a.akamaihd.net/steam/apps/259340/header.jpg?t=1512666396,https://steamcdn-a.akamaihd.net/steam/apps/259340/page_bg_generated_v6b.jpg?t=1512666396,"This tiresome bunch of feathered troublemakers is not giving any peace. Stop this hostile destruction from these rampaging roosters in Arcade mode, or fight against the clock in Classic mode in three difficulty levels."
23323,889720,Crypto Crisis,2019-02-20,1,Armoured Beans,Armoured Beans,windows;mac;linux,0,Single-player;Steam Achievements,Indie;Simulation;Strategy,Simulation;Strategy;Indie,7,12,6,0,0,0-20000,6.19,https://steamcdn-a.akamaihd.net/steam/apps/889720/header.jpg?t=1550713784,https://steamcdn-a.akamaihd.net/steam/apps/889720/page_bg_generated_v6b.jpg?t=1550713784,Where were you during the rise of Bitcoin? Crypto Crisis is a simulation game which drops you into the beginnings of Bitcoin. Compete for and increase your share of block rewards by building and upgrading your mining rigs while carefully managing your resources.
13222,589160,Zombie Apocalypse,2017-02-15,1,GameTop.com,GameTop.com,windows,0,Single-player,Action,Action;Zombies;Multiplayer,0,27,17,10,10,0-20000,0.0,https://steamcdn-a.akamaihd.net/steam/apps/589160/header.jpg?t=1487242335,https://steamcdn-a.akamaihd.net/steam/apps/589160/page_bg_generated_v6b.jpg?t=1487242335,The disaster has turned people into zombies. The survivors are hiding in the shelters.
6637,397460,The Jackbox Party Pack 2,2015-10-13,1,"Jackbox Games Inc.","Jackbox Games Inc.",windows;mac;linux,0,Single-player;Local Multi-Player;Local Co-op;Steam Achievements;Steam Trading Cards;Partial Controller Support;Steam Cloud,Casual;Indie;Strategy,Local Multiplayer;Casual;Indie,20,533,32,264,264,200000-500000,18.99,https://steamcdn-a.akamaihd.net/steam/apps/397460/header.jpg?t=1546966617,https://steamcdn-a.akamaihd.net/steam/apps/397460/page_bg_generated_v6b.jpg?t=1546966617,"The sequel to the party game phenomenon The Jackbox Party Pack, featuring FIVE fresh, rib-tickling party games! Your phones or tablets are your controllers – no big mess of controllers needed. For up to 8 players plus an Audience of up to 10,000! It’s a game-night riot in a box… without the box!"
5869,375680,Apartment 666,2016-08-03,1,I Need Play,I Need Play,windows;mac,0,Single-player;Steam Achievements;Steam Trading Cards,Action;Adventure;Indie,Action;Adventure;Indie,2,103,227,254,259,200000-500000,0.79,https://steamcdn-a.akamaihd.net/steam/apps/375680/header.jpg?t=1495360523,https://steamcdn-a.akamaihd.net/steam/apps/375680/page_bg_generated_v6b.jpg?t=1495360523,One day you wake up and realise that nobody is home. You try to exit the apartment only to wake up again in your room.You are stuck in an endless cycle of loops with only one way out.
26768,1036870,Night Catcher,2019-03-22,1,Exsom,Exsom,windows,0,Single-player;Steam Achievements;Steam Cloud,Adventure;Indie,Indie;Adventure;Horror,2,16,1,0,0,0-20000,2.09,https://steamcdn-a.akamaihd.net/steam/apps/1036870/header.jpg?t=1553526186,https://steamcdn-a.akamaihd.net/steam/apps/1036870/page_bg_generated_v6b.jpg?t=1553526186,"You are the cop who fell asleep in his office. Waking up, you learn of some psychopath who craves for your death and informs of this through notes. Try to get out of the police station avoiding meeting the robot guard."
22076,852920,Bad Bots Rise,2018-07-06,1,High Leap Studios,Lamina Studios,windows;mac;linux,0,Single-player,Action;Adventure;Indie;Early Access,Early Access;Action;Adventure,0,1,3,0,0,0-20000,3.99,https://steamcdn-a.akamaihd.net/steam/apps/852920/header.jpg?t=1535811050,https://steamcdn-a.akamaihd.net/steam/apps/852920/page_bg_generated_v6b.jpg?t=1535811050,"Bad Bots Rise is an action-packed platform-shooter. Dodge bullets, evade traps and destroy enemies in a 2D sidescroller environment. Explore different levels and choose the right character for the right scenario. Utilize keystones' passive abilities to enhance your playstyle."
17068,705740,Car Demolition Clicker,2018-07-05,1,Blue Sunset Games,Blue Sunset Games,windows,0,Single-player;Steam Achievements;Steam Leaderboards,Action;Casual;Indie,Action;Indie;Casual,22,27,15,0,0,0-20000,5.19,https://steamcdn-a.akamaihd.net/steam/apps/705740/header.jpg?t=1541784246,https://steamcdn-a.akamaihd.net/steam/apps/705740/page_bg_generated_v6b.jpg?t=1541784246,"Ever dreamed of smashing your own car? Or maybe a car of your neighbour? Well... now you have a chance! Grab your weapon, call out your battle drones and start clicking the car into oblivion! Earn cash, upgrade your equipment and find more vehicles to destroy!"
13573,600260,Jungle Dino VR,2017-02-27,1,eiNpictures,eiNpictures,windows,0,Single-player;Partial Controller Support,Adventure;Indie;Simulation,Adventure;Indie;Simulation,0,0,1,0,0,0-20000,6.99,https://steamcdn-a.akamaihd.net/steam/apps/600260/header.jpg?t=1488414755,https://steamcdn-a.akamaihd.net/steam/apps/600260/page_bg_generated_v6b.jpg?t=1488414755,Take a trip to a dinosaur inhabited island and explore a variety of environments where you’ll encounter many different kinds of dinosaurs.
7352,418360,Gurgamoth,2016-02-16,1,Galvanic Games,Galvanic Games,windows;mac,0,Single-player;Local Multi-Player;Shared/Split Screen;Full controller support;Steam Trading Cards,Action;Indie,Action;Indie;Local Multiplayer,0,67,11,0,0,20000-50000,3.99,https://steamcdn-a.akamaihd.net/steam/apps/418360/header.jpg?t=1548803463,https://steamcdn-a.akamaihd.net/steam/apps/418360/page_bg_generated_v6b.jpg?t=1548803463,"Gurgamoth is a flying fighting game where the level is your weapon. Each match is lightning quick and focuses on intense flying combat and getting in your opponent's head. The controls are simple, but the mechanics and interesting levels bring out the game’s depth."
2873,288860,Realms of Arkania: Star Trail,2017-08-10,1,Crafty Studios,United Independent Entertainment GmbH,windows;mac;linux,0,Single-player;Steam Achievements;Steam Trading Cards;Steam Workshop;Steam Cloud,Adventure;Indie;RPG,RPG;Adventure;Indie,82,84,27,0,0,0-20000,22.99,https://steamcdn-a.akamaihd.net/steam/apps/288860/header.jpg?t=1503309431,https://steamcdn-a.akamaihd.net/steam/apps/288860/page_bg_generated_v6b.jpg?t=1503309431,"Star Trail is a faithful remake of Realms of Arkania’s classic sequel. This hardcore RPG features dozens of talents and spells, distinct races and character classes as well as a challenging isometric turn-based combat system."
19997,790050,Porcelain Panic,2018-02-19,1,Alone Games,Alone Games,windows,0,Single-player,Action;Casual;Indie;Simulation,Action;Indie;Casual,0,3,0,0,0,0-20000,0.79,https://steamcdn-a.akamaihd.net/steam/apps/790050/header.jpg?t=1519028667,https://steamcdn-a.akamaihd.net/steam/apps/790050/page_bg_generated_v6b.jpg?t=1519028667,"Learn how to use the correct bog in this fast paced bog simulator that features a princess, a bog-lord and a lack of pants."
1510,221540,DG2: Defense Grid 2,2014-09-23,1,Hidden Path Entertainment,505 Games,windows,0,Single-player;Multi-player;Co-op;Shared/Split Screen;Steam Achievements;Full controller support;Steam Trading Cards;Captions available;Steam Workshop;Steam Cloud;Stats;Steam Leaderboards;Includes level editor,Indie;Strategy,Tower Defense;Strategy;Sci-fi,65,1579,354,3601,3601,100000-200000,10.99,https://steamcdn-a.akamaihd.net/steam/apps/221540/header.jpg?t=1527182555,https://steamcdn-a.akamaihd.net/steam/apps/221540/page_bg_generated_v6b.jpg?t=1527182555,"Setting the bar as the definitive tower defense game, Defense Grid 2 introduces new worlds and threats to test your tower placement strategies. With a bold new look and the addition of new game modes, player-versus-player and multiplayer co-op, every play brings fun new opportunities and challenges."
6459,392160,X4: Foundations,2018-11-30,1,Egosoft,Egosoft,windows,0,Single-player;Steam Achievements;Full controller support;Steam Trading Cards;Steam Workshop;Steam Cloud,Action;Simulation,Space;Simulation;Sandbox,44,3557,1714,873,873,100000-200000,39.99,https://steamcdn-a.akamaihd.net/steam/apps/392160/header.jpg?t=1551798864,https://steamcdn-a.akamaihd.net/steam/apps/392160/page_bg_generated_v6b.jpg?t=1551798864,"X4: FOUNDATIONS, the long awaited sequel in the successful X series, brings our most sophisticated universe SIMULATION ever. Fly every ship, EXPLORE space or manage an empire; TRADE, FIGHT, BUILD and THINK carefully, while you embark on an epic journey."
25143,959440,Blockz VS Ballz,2018-10-24,1,hallunazigames,hallunazigames,windows,0,Single-player,Action;Casual;Indie,Action;Indie;Casual,0,1,4,0,0,0-20000,0.79,https://steamcdn-a.akamaihd.net/steam/apps/959440/header.jpg?t=1540372905,https://steamcdn-a.akamaihd.net/steam/apps/959440/page_bg_generated_v6b.jpg?t=1540372905,"This is a symbiosis of several games. Collect balls in the squad and attack the cubes. The more blocks the squad wins, the more points the player gains. Play without any sounds and music. Just relax while controlling the balls."
22136,854870,Perseverance: Part 1,2018-07-23,1,Tap It Games;Bit Golem,Tap It Games,windows,18,Single-player;Steam Achievements;Partial Controller Support;Steam Cloud,Violent;Adventure;Indie,Adventure;Indie;Violent,13,28,1,0,0,0-20000,2.99,https://steamcdn-a.akamaihd.net/steam/apps/854870/header.jpg?t=1533988019,https://steamcdn-a.akamaihd.net/steam/apps/854870/page_bg_generated_v6b.jpg?t=1533988019,"Perseverance is a horror/drama visual novel about survival and redemption. In Part 1 you play as Jack, a father who is struggling to keep his family together and finds himself in the middle of horrific events."
19640,779840,Forgotten Sound 1: Revelation,2018-01-18,1,RSK Entertainment,Strategy First,windows,0,Single-player,Adventure,Adventure;Indie;Puzzle,0,0,2,0,0,0-20000,7.19,https://steamcdn-a.akamaihd.net/steam/apps/779840/header.jpg?t=1516294678,https://steamcdn-a.akamaihd.net/steam/apps/779840/page_bg_generated_v6b.jpg?t=1516294678,"“Music is the melody of life”. Prince Shahbaz remembers hearing this sentence constantly from his mother. Following her death, Shahrdad Shah, his father, had forbidden playing all instruments as he couldn’t bear the memory of his beloved wife that accompanied the music."
5221,359250,City of Fools,2015-07-10,1,Absolutist Ltd.,Absolutist Ltd.,windows;mac,0,Single-player;Steam Achievements;Steam Trading Cards,Adventure;Casual;Indie,Adventure;Indie;Casual,6,47,20,0,0,20000-50000,5.59,https://steamcdn-a.akamaihd.net/steam/apps/359250/header.jpg?t=1536664173,https://steamcdn-a.akamaihd.net/steam/apps/359250/page_bg_generated_v6b.jpg?t=1536664173,"Tundel has three evils – fools, roads and the mayor, who hides a UFO from the public. You are a successful journalist of a famous magazine. The Editor in Chief sends you to the town of Tundel on a mission to write about the mysterious incident. In order to complete the mission you'll need all your patience, wits and communication skills."
6748,400450,NeuroVoider,2016-08-31,1,Flying Oak Games,Dear Villagers,windows;mac;linux,0,Single-player;Local Co-op;Shared/Split Screen;Steam Achievements;Full controller support;Steam Trading Cards;Steam Cloud;Steam Leaderboards,Action;Indie;RPG,Indie;Action;RPG,38,317,87,177,177,20000-50000,10.59,https://steamcdn-a.akamaihd.net/steam/apps/400450/header.jpg?t=1554296188,https://steamcdn-a.akamaihd.net/steam/apps/400450/page_bg_generated_v6b.jpg?t=1554296188,"NeuroVoider is a twin-stick shooter RPG set in a cyber futuristic world about brains shooting around evil robots with nuclear rocket launchers. Battle through the horde of vigilant robots, boost your character with the smoking remains of your victims, and defeat the master NeuroVoider."
1638,230820,The Night of the Rabbit,2013-05-28,1,Daedalic Entertainment,Daedalic Entertainment,windows;mac,0,Single-player;Steam Achievements;Steam Trading Cards;Steam Cloud,Adventure;Indie,Adventure;Point & Click;Indie,17,1700,179,96,112,200000-500000,16.99,https://steamcdn-a.akamaihd.net/steam/apps/230820/header.jpg?t=1524052332,https://steamcdn-a.akamaihd.net/steam/apps/230820/page_bg_generated_v6b.jpg?t=1524052332,"Lose yourself in a tale of magic and wonder, where anything is possible and where nothing is quite as it seems: join young Jerry and follow a peculiar white rabbit to the wondrous realm of Mousewood, a land where critters can speak and where mystery abounds."
5380,363670,Seeders,2015-08-21,1,Bigosaur,Bigosaur,windows,0,Single-player;Multi-player;Co-op;Shared/Split Screen;Full controller support;Steam Trading Cards,Indie,Indie;Puzzle;Puzzle-Platformer,0,18,13,0,0,0-20000,6.99,https://steamcdn-a.akamaihd.net/steam/apps/363670/header.jpg?t=1541187957,https://steamcdn-a.akamaihd.net/steam/apps/363670/page_bg_generated_v6b.jpg?t=1541187957,Seeders is a puzzle platformer with funky physics and mind boggling puzzles requiring out-of-the-box thinking and persistence. Only a few players were able to complete the game. Can you handle it?
22939,877910,Time Drifter,2018-07-29,1,Lonely Boy Studio Inc.,Lonely Boy Studio Inc.,windows,0,Single-player,Action;Adventure;Casual;Free to Play;Indie,Free to Play;Action;Indie,0,68,16,0,0,0-20000,0.0,https://steamcdn-a.akamaihd.net/steam/apps/877910/header.jpg?t=1532919465,https://steamcdn-a.akamaihd.net/steam/apps/877910/page_bg_generated_v6b.jpg?t=1532919465,Drift your way through time to save humanity from an evil panda.
626,33460,From Dust,2011-08-17,1,Ubisoft Montpellier,Ubisoft,windows,0,Single-player,Adventure;Simulation,God Game;Simulation;Adventure,0,1356,750,358,399,200000-500000,8.59,https://steamcdn-a.akamaihd.net/steam/apps/33460/header.jpg?t=1452181703,https://steamcdn-a.akamaihd.net/steam/apps/33460/page_bg_generated_v6b.jpg?t=1452181703,Immerse yourself in a world as exotically beautiful as it is dangerous in this modern God-Game where Nature is the Star!
26572,1025740,The Woods: VR Escape the Room,2019-04-04,1,Blue Entropy Studios,Blue Entropy Studios,windows,0,Single-player,Adventure;Indie;Strategy,Adventure;Indie;Strategy,0,3,7,0,0,0-20000,3.99,https://steamcdn-a.akamaihd.net/steam/apps/1025740/header.jpg?t=1554401726,https://steamcdn-a.akamaihd.net/steam/apps/1025740/page_bg_generated_v6b.jpg?t=1554401726,"After a walk in the woods, you find yourself locked in a swaying cage above the forest floor, with no recollection of how you got there. Discover the mysteries this forest has to offer. Solve puzzles, decipher ancient texts, and uncover the mystical secrets hidden within these woods for many years."
