steamid,appid,name,release_date,english,developer,publisher,platforms,required_age,categories,genres,steamspy_tags,achievements,positive_ratings,negative_ratings,average_playtime,median_playtime,owners,price,header_image,background,short_description
23627,899180,Voronium - Locust Sols,2018-11-16,1,Gamalocus Studios,Gamalocus Studios,windows,0,Single-player,Action;Indie;Strategy,Indie;Action;Strategy,0,24,2,0,0,0-20000,11.39,https://steamcdn-a.akamaihd.net/steam/apps/899180/header.jpg?t=1542365570,https://steamcdn-a.akamaihd.net/steam/apps/899180/page_bg_generated_v6b.jpg?t=1542365570,"Voronium takes place on a planet far away. Mankind has discovered Voronium which became it's ultimate energy source. Your job is to protect the Voronium mining operation at all cost, building defensive structures and operating them simultaneously. On VR only."
18143,737690,Bernackels' Shoggoth,2017-12-08,1,Bernackels,Bernackels,windows,0,Multi-player;Online Multi-Player;Local Multi-Player;Co-op;Online Co-op;Steam Achievements;Partial Controller Support;Steam Cloud,Action;Indie,Indie;Action;Stealth,49,15,5,0,0,0-20000,9.99,https://steamcdn-a.akamaihd.net/steam/apps/737690/header.jpg?t=1520190217,https://steamcdn-a.akamaihd.net/steam/apps/737690/page_bg_generated_v6b.jpg?t=1520190217,"Shoggoth is a multiplayer (4vs2) stealth game, in which the player takes on the role of a small dragon. With the ability to fly and to morph into items, your mission is either to seek and kill your opponents or to search for keys and escape the level."
15906,673950,Farm Together,2018-10-11,1,Milkstone Studios,Milkstone Studios,windows;mac;linux,0,Single-player;Multi-player;Online Multi-Player;Local Multi-Player;Co-op;Online Co-op;Local Co-op;Shared/Split Screen;Steam Achievements;Full controller support;Steam Trading Cards;Steam Cloud,Casual;Indie;Simulation,Simulation;Multiplayer;Agriculture,45,4022,407,35,35,100000-200000,15.49,https://steamcdn-a.akamaihd.net/steam/apps/673950/header.jpg?t=1552580561,https://steamcdn-a.akamaihd.net/steam/apps/673950/page_bg_generated_v6b.jpg?t=1552580561,"Grow your own farm all by yourself, or cooperate with your friends in this unique, relaxing farming experience!"
20067,791970,QLORB,2018-02-06,1,Red Dolphin Games,VT Publishing,windows,0,Single-player;Steam Achievements,Action;Casual;Indie;Strategy,Strategy;Action;Indie,5000,18,16,0,0,0-20000,3.99,https://steamcdn-a.akamaihd.net/steam/apps/791970/header.jpg?t=1547181876,https://steamcdn-a.akamaihd.net/steam/apps/791970/page_bg_generated_v6b.jpg?t=1547181876,"QLORB is a puzzle game designed to take the simplicity of games like tetris and deconstruct it into something familiar but different. With QLORB, 2 sets of blocks must merge into 1 perfect block. In order for this to be accomplished the player must clear away all of the blue blocks so the red blocks have room."
25645,979720,Big Bash Boom,2018-12-20,1,Big Ant Studios,Big Ant Studios,windows,0,Single-player;Multi-player;Online Multi-Player;Local Multi-Player;Steam Achievements;Full controller support;Steam Cloud,Sports,Sports,30,3,1,0,0,0-20000,44.99,https://steamcdn-a.akamaihd.net/steam/apps/979720/header.jpg?t=1556520769,https://steamcdn-a.akamaihd.net/steam/apps/979720/page_bg_generated_v6b.jpg?t=1556520769,Big Bash Boom mixes all the big hitting thrills of T20 cricket with instantly accessible arcade action. Fully licensed and includes all teams and players featured in this year’s KFC Big Bash League (BBL) and Rebel Women’s Big Bash League (WBBL).
17507,718210,Depopulation,2017-11-24,1,Aweswan studios,Aweswan studios,windows,0,Single-player,Violent;Casual;RPG;Simulation;Strategy,Casual;Strategy;RPG,0,10,5,0,0,0-20000,3.99,https://steamcdn-a.akamaihd.net/steam/apps/718210/header.jpg?t=1512466372,https://steamcdn-a.akamaihd.net/steam/apps/718210/page_bg_generated_v6b.jpg?t=1512466372,"The world’s pollution is threatening all life on Earth. Employed by a Billionaire, and chosen for your high intelligence and psychopathic tendencies, it’s up to you to save the world by any means necessary."
9502,489050,Whitetail Challenge,2016-06-20,1,PSR Outdoors,PSR Outdoors,windows,0,Single-player;Steam Achievements,Action;Adventure;Indie;Simulation,Action;Adventure;Indie,18,3,8,0,0,0-20000,2.79,https://steamcdn-a.akamaihd.net/steam/apps/489050/header.jpg?t=1466473359,https://steamcdn-a.akamaihd.net/steam/apps/489050/page_bg_generated_v6b.jpg?t=1466473359,"Experience the ultimate outdoors survival/hunting game. Predators, lack of food, and exposure can quickly end your quest. Stay alive and continue to hunt more productive areas. Explore, hunt, experience and enjoy...."
19048,763540,Hitori,2018-01-12,1,Sly,SlyGames,windows;mac;linux,0,Single-player;Steam Achievements,Casual;Indie,Indie;Casual,33,11,8,0,0,0-20000,0.78,https://steamcdn-a.akamaihd.net/steam/apps/763540/header.jpg?t=1539738466,https://steamcdn-a.akamaihd.net/steam/apps/763540/page_bg_generated_v6b.jpg?t=1539738466,"Hitori is a classic hitori where you are to make certain cells dark enough so that no bright element repeats in each row and column. Dark cells can not stand side by side vertically and horizontally, and also surround light cells in the ring."
372,15920,Luxor 2,2008-06-10,1,MumboJumbo,MumboJumbo,windows,0,Single-player,Casual,Casual,0,7,14,0,0,20000-50000,5.99,https://steamcdn-a.akamaihd.net/steam/apps/15920/header.jpg?t=1447351186,https://steamcdn-a.akamaihd.net/steam/apps/15920/page_bg_generated_v6b.jpg?t=1447351186,"The much anticipated sequel to the #1 casual game of 2005, LUXOR 2 sets the new standard for action-puzzlers. LUXOR 2 takes you on a beautiful voyage through 88 all-new, gorgeously rendered levels set amongst the pyramids of ancient Egypt."
4574,342510,Bret Airborne,2015-01-29,1,Machine 22,Machine 22,windows,0,Single-player;Steam Trading Cards,Casual;Indie;RPG,RPG;Indie;Casual,0,40,21,55,55,0-20000,3.99,https://steamcdn-a.akamaihd.net/steam/apps/342510/header.jpg?t=1478024032,https://steamcdn-a.akamaihd.net/steam/apps/342510/page_bg_generated_v6b.jpg?t=1478024032,Bret Airborne shakes up the standard match-3 formula with strategic gameplay and original game mechanics.
26349,1014140,Snakebird Primer,2019-02-20,1,Noumenon Games,Noumenon Games,windows;mac;linux,0,Single-player;Steam Achievements;Full controller support;Steam Cloud,Casual;Indie,Indie;Casual;Puzzle,12,32,1,0,0,0-20000,5.79,https://steamcdn-a.akamaihd.net/steam/apps/1014140/header.jpg?t=1551103393,https://steamcdn-a.akamaihd.net/steam/apps/1014140/page_bg_generated_v6b.jpg?t=1551103393,"The snakebirds are back, this time yellowbird joins the team on a more relaxed island with easier puzzles. A casual puzzle game for the entire family as well as a primer for the serious challenges of the original game."
22949,878150,Core Awaken ~The Yuka~,2018-07-10,1,Celusis,CelLab,windows,0,Single-player;Partial Controller Support,Action;Indie,Action;Indie;Anime,0,17,2,0,0,0-20000,7.19,https://steamcdn-a.akamaihd.net/steam/apps/878150/header.jpg?t=1542591503,https://steamcdn-a.akamaihd.net/steam/apps/878150/page_bg_generated_v6b.jpg?t=1542591503,A 2D scrolling action game with 3DCG. The protagonist YUKA is a robot fighting for the human side against a robotic rebellion.
26192,1006920,Pull Ball,2019-01-18,1,Nichengun,Nichengun,windows;mac,0,Single-player;Steam Achievements;Steam Leaderboards,Casual;Indie,Indie;Casual;Puzzle,100,3,1,0,0,0-20000,0.79,https://steamcdn-a.akamaihd.net/steam/apps/1006920/header.jpg?t=1547880424,https://steamcdn-a.akamaihd.net/steam/apps/1006920/page_bg_generated_v6b.jpg?t=1547880424,"Minimalist ball game with original gameplay, including 90 levels with puzzle elements and endless survival mode. You can also compete with other players live."
26344,1013940,Bob and Kuura: Lost in Snowglobe,2019-02-06,1,BelleGames Ltd.,BelleGames Ltd.,windows,0,Single-player;Steam Achievements;Steam Cloud,Adventure;Indie,Adventure;Indie,6,0,1,0,0,0-20000,4.79,https://steamcdn-a.akamaihd.net/steam/apps/1013940/header.jpg?t=1549453472,https://steamcdn-a.akamaihd.net/steam/apps/1013940/page_bg_generated_v6b.jpg?t=1549453472,Snowglobe has been ruined by the Evil Duke's corporation and it's up to you to save it.
21616,839560,Shrinking Pains,2018-04-27,1,Bedtime Phobias,Bedtime Phobias,windows,0,Single-player,Sexual Content;Free to Play;Indie,Free to Play;Indie;Sexual Content,0,96,24,0,0,20000-50000,0.0,https://steamcdn-a.akamaihd.net/steam/apps/839560/header.jpg?t=1524874054,https://steamcdn-a.akamaihd.net/steam/apps/839560/page_bg_generated_v6b.jpg?t=1524874054,"You spend a day seeing how many coins you can fit into the hollows above your collarbones. You're losing yourself first in inches, then moments... Will you survive yourself?"
1576,225840,Sven Co-op,2016-01-22,1,Sven Co-op Team,Sven Co-op Team,windows,18,Multi-player;Online Multi-Player;Local Multi-Player;Co-op;Online Co-op;Local Co-op;Partial Controller Support;Steam Cloud,Action;Casual;Free to Play;Indie,Free to Play;Multiplayer;Co-op,0,12211,1173,407,56,2000000-5000000,0.0,https://steamcdn-a.akamaihd.net/steam/apps/225840/header.jpg?t=1553967563,https://steamcdn-a.akamaihd.net/steam/apps/225840/page_bg_generated_v6b.jpg?t=1553967563,Sven Co-op is a co-operative game originally based around Valve Software's Half-Life. In this game players must work together against computer controlled enemies and solve puzzles as a team.
5721,371530,Legends of Pixelia,2015-09-14,1,SimaGames,SimaGames,windows;mac;linux,0,Single-player;Local Multi-Player;Local Co-op;Shared/Split Screen;Steam Achievements;Full controller support;Steam Trading Cards;Steam Cloud;Stats,Action;Indie;RPG,Action;RPG;Indie,69,19,2,0,0,0-20000,4.99,https://steamcdn-a.akamaihd.net/steam/apps/371530/header.jpg?t=1487237169,https://steamcdn-a.akamaihd.net/steam/apps/371530/page_bg_generated_v6b.jpg?t=1487237169,"Legends of Pixelia is an action RPG that combines retro pixelart with modern gameplay mechanics. Choose a hero class, crawl through procedurally generated dungeons and show your reflexes in challenging boss fights. Single player &amp; local multiplayer, best played with gamepad."
19916,788190,SUPER ASTEROIDS,2018-03-08,1,Alcateia Entertainment,Alcateia Entertainment,windows,0,Single-player;Steam Achievements;Full controller support;Steam Leaderboards,Action;Casual;Indie,Action;Indie;Casual,10,12,4,0,0,0-20000,0.79,https://steamcdn-a.akamaihd.net/steam/apps/788190/header.jpg?t=1528880247,https://steamcdn-a.akamaihd.net/steam/apps/788190/page_bg_generated_v6b.jpg?t=1528880247,Super Asteroids is an arcade game based on the classics from the 80's. With a refined and pleasant gameplay. Destroy all the asteroids! And stick your score among the best players around the world!
24772,944380,Drunk Puppet,2018-10-06,1,D1ONE,D1ONE,windows,0,Single-player,Casual,Casual,0,4,7,0,0,0-20000,2.89,https://steamcdn-a.akamaihd.net/steam/apps/944380/header.jpg?t=1538827731,https://steamcdn-a.akamaihd.net/steam/apps/944380/page_bg_generated_v6b.jpg?t=1538827731,"Drunk Puppet is the most realistic walking simulator you'll be playing this year! Keep calm, because you are waiting for insurmountable difficulties, such as careless drivers and an inexplicable inability to step on the cracks on the sidewalk. You will laugh. You will cry."
15761,670750,0°N 0°W,2018-03-01,1,Colorfiction,Colorfiction,windows;mac;linux,0,Single-player;Partial Controller Support,Adventure;Casual;Indie,Adventure;Indie;Casual,0,87,6,0,0,0-20000,6.19,https://steamcdn-a.akamaihd.net/steam/apps/670750/header.jpg?t=1555148721,https://steamcdn-a.akamaihd.net/steam/apps/670750/page_bg_generated_v6b.jpg?t=1555148721,Enjoy a surreal vacation in a magical dimension full of audio visual stimulation!
20264,797330,Fantasy Mosaics 23: Magic Forest,2018-03-08,1,Andy Jurko,Andy Jurko,windows,0,Single-player,Casual;Indie;Strategy,Casual;Strategy;Indie,0,3,0,0,0,0-20000,5.19,https://steamcdn-a.akamaihd.net/steam/apps/797330/header.jpg?t=1520514672,https://steamcdn-a.akamaihd.net/steam/apps/797330/page_bg_generated_v6b.jpg?t=1520514672,Join the penguins on their journey to a magic forest!
24656,939270,Bad Neighbor,2018-09-26,1,MintBottle,Dagestan Technology,windows,0,Single-player;Steam Achievements,Action;Adventure;Indie,Action;Indie;Adventure,10,4,2,0,0,0-20000,3.19,https://steamcdn-a.akamaihd.net/steam/apps/939270/header.jpg?t=1537952835,https://steamcdn-a.akamaihd.net/steam/apps/939270/page_bg_generated_v6b.jpg?t=1537952835,Bad neighbor - this is a short story about the person who has to carry out the orders of gang's head under protest.
24923,950160,Miracle Circus,2018-10-05,1,灰猫,0Cube,windows,0,Single-player;Partial Controller Support,Adventure;Casual;Indie;RPG;Strategy,Casual;Adventure;RPG,0,29,4,0,0,0-20000,2.89,https://steamcdn-a.akamaihd.net/steam/apps/950160/header.jpg?t=1549892999,https://steamcdn-a.akamaihd.net/steam/apps/950160/page_bg_generated_v6b.jpg?t=1549892999,"Qi joins the miracle circus as a genius magician. The other members all welcome Qi’s coming, like Liao, Liu, Ji, Xiang,Ning. But as the night is near around, something is approaching, straightly to their heart. Who is watching? And who are the demons of night exactly? Qi starts his investigation on a common day like this..."
22354,860670,❂ Hexaluga ❂ Dungeons and Hunting ☠,2018-05-22,1,hede,hede,windows,0,Single-player,Action;Adventure;Indie;RPG;Strategy;Early Access,Early Access;Indie;Strategy,0,3,3,0,0,0-20000,5.19,https://steamcdn-a.akamaihd.net/steam/apps/860670/header.jpg?t=1553638466,https://steamcdn-a.akamaihd.net/steam/apps/860670/page_bg_generated_v6b.jpg?t=1553638466,Gather a party of heroic fighters and lead them through various dungeons to hunt dangerous monsters in this atmospheric RPG-clicker game.
5535,367010,Vernon's Legacy,2016-09-23,1,TripleBrick,TripleBrick,windows,0,Single-player;Steam Trading Cards,Adventure;Indie,Indie;Adventure;Horror,0,62,41,0,0,0-20000,8.99,https://steamcdn-a.akamaihd.net/steam/apps/367010/header.jpg?t=1478178738,https://steamcdn-a.akamaihd.net/steam/apps/367010/page_bg_generated_v6b.jpg?t=1478178738,"Vernon's Legacy is an horror adventure with an enigmatic story that takes place nearly a century ago. You are playing as Robert, the new owner of Dunkenhof manor."
16657,694090,Apex Construct,2018-03-20,1,Fast Travel Games,Fast Travel Games,windows,0,Single-player;Steam Achievements,Action;Adventure,Action;Adventure;Singleplayer,15,82,30,0,0,0-20000,14.99,https://steamcdn-a.akamaihd.net/steam/apps/694090/header.jpg?t=1552091911,https://steamcdn-a.akamaihd.net/steam/apps/694090/page_bg_generated_v6b.jpg?t=1552091911,"Apex Construct is a story-driven, single player action/adventure made exclusively for VR. Wield an upgradable cyber bow &amp; shield combination to battle enemy robots while exploring a shattered world, gradually realizing what led to the extinction of mankind."
23303,889040,FPV Air 2,2018-08-17,1,Flyleap Studios,Flyleap Studios,windows,0,Single-player;Multi-player;Online Multi-Player;In-App Purchases;Partial Controller Support,Racing;Simulation,Simulation;Racing,0,67,13,0,0,0-20000,3.99,https://steamcdn-a.akamaihd.net/steam/apps/889040/header.jpg?t=1545259733,https://steamcdn-a.akamaihd.net/steam/apps/889040/page_bg_generated_v6b.jpg?t=1545259733,FPV Air 2 is a quadcopter flight simulator for serious FPV racing pilots who want a tool for meaningful/realistic flight practice in any weather.
21851,845860,Gem Rush,2018-08-06,1,"Quicksilver Software Inc.","Quicksilver Software Inc.",windows;mac;linux,0,Single-player;Multi-player;Online Multi-Player;Local Multi-Player;Co-op;Online Co-op;Local Co-op;Cross-Platform Multiplayer;Steam Achievements,Casual;Indie;Strategy,Casual;Strategy;Indie,52,6,1,0,0,0-20000,7.19,https://steamcdn-a.akamaihd.net/steam/apps/845860/header.jpg?t=1542145147,https://steamcdn-a.akamaihd.net/steam/apps/845860/page_bg_generated_v6b.jpg?t=1542145147,"This mountain is rich in mystic gems. Combine gems to open up new rooms, providing new ways to dig up gems. Race against other players or race together against the clock to dig the greatest mine in this fast-paced, easy-to-learn strategy game."
24601,937690,冒险公会 Adventurer Guild,2018-11-15,0,DyingCat,INDIEGAMES.CN,windows,0,Single-player;Steam Achievements;Steam Cloud,Indie;Simulation;Strategy;Early Access,Early Access;Strategy;Indie,33,19,11,0,0,0-20000,5.19,https://steamcdn-a.akamaihd.net/steam/apps/937690/header.jpg?t=1543574332,https://steamcdn-a.akamaihd.net/steam/apps/937690/page_bg_generated_v6b.jpg?t=1543574332,在各种权势之间周旋，为市民提供福祉，招募冒险家，完成委托，经营属于自己的冒险公会。
18772,755950,Fantasy Quest Solitaire,2018-01-16,1,rokapublish,rokapublish,windows;mac,0,Single-player;Steam Achievements,Casual,Casual;Card Game;Adventure,16,23,1,0,0,0-20000,6.19,https://steamcdn-a.akamaihd.net/steam/apps/755950/header.jpg?t=1554458730,https://steamcdn-a.akamaihd.net/steam/apps/755950/page_bg_generated_v6b.jpg?t=1554458730,At the very last moment the Fairy Land was saved from the dark shadows. But now absolute chaos is threatening its peaceful denizens. King Feodor asks the magic Fairies for help. Are you ready to face this challenge? Play your cards right and solve many challenging quests.
4898,350780,MANOS,2015-07-30,1,FreakZone Games,FreakZone Games,windows,0,Single-player;Steam Achievements;Full controller support;Steam Leaderboards,Action;Adventure;Indie,Indie;Action;Adventure,6,123,30,9,9,20000-50000,2.09,https://steamcdn-a.akamaihd.net/steam/apps/350780/header.jpg?t=1488463752,https://steamcdn-a.akamaihd.net/steam/apps/350780/page_bg_generated_v6b.jpg?t=1488463752,Retro platforming action in this adaptation of a terrible movie.
25342,967210,Spark Five,2018-11-14,1,TechBridge Interactive,TechBridge Interactive,windows;mac,0,Single-player;Steam Achievements;Partial Controller Support,Action;Adventure;Casual;Indie,Action;Indie;Casual,16,1,0,0,0,0-20000,2.09,https://steamcdn-a.akamaihd.net/steam/apps/967210/header.jpg?t=1545846926,https://steamcdn-a.akamaihd.net/steam/apps/967210/page_bg_generated_v6b.jpg?t=1545846926,"Welcome to Project Spark. Help our little android friend navigate across multiple, challenging levels in search of bio-matter. You see, we are in desperate need of those primarily to restore human civilization and undo the damage caused by our own problem child - Artificial Intelligence."
24572,936650,Space Pilgrim Academy: Year 3,2018-10-12,1,Pilgrim Adventures, GrabTheGames,windows,0,Single-player;Steam Achievements;Full controller support,Adventure;Indie,Adventure;Indie;RPGMaker,9,17,0,0,0,0-20000,1.69,https://steamcdn-a.akamaihd.net/steam/apps/936650/header.jpg?t=1554170668,https://steamcdn-a.akamaihd.net/steam/apps/936650/page_bg_generated_v6b.jpg?t=1554170668,A mining fleet gone rogue on the edge of space. Dangerous figures emerging from the past. This year could be a killer.
276,11230,Gumboy Tournament,2008-05-19,1,"CINEMAX s.r.o.","CINEMAX s.r.o.",windows,0,Single-player;Multi-player,Casual;Indie;Racing,Indie;Casual;Racing,0,351,142,46,49,50000-100000,1.79,https://steamcdn-a.akamaihd.net/steam/apps/11230/header.jpg?t=1490107858,https://steamcdn-a.akamaihd.net/steam/apps/11230/page_bg_generated_v6b.jpg?t=1490107858,"Test your reflexes, judgment and tactics while facing up to eight other players in this follow-up to the critically acclaimed and popular arcade game Gumboy: Crazy Adventures, winner of numerous accolades including Gametunnel's GAME OF THE YEAR 2006."
9650,493280,WALLSLIDE,2016-07-14,1,Red Matter Studio,Red Matter Studio,windows,0,Single-player;Steam Trading Cards;Steam Workshop,Action;Indie;Early Access,Early Access;Action;Indie,0,84,20,261,288,50000-100000,0.79,https://steamcdn-a.akamaihd.net/steam/apps/493280/header.jpg?t=1531606431,https://steamcdn-a.akamaihd.net/steam/apps/493280/page_bg_generated_v6b.jpg?t=1531606431,"Wallslide is all about tight controls, high speeds and big jumps."
11342,538330,A-Escape VR,2017-03-31,1,CTN Design,A-Escape,windows,0,Single-player,Adventure;Indie,Adventure;Indie;VR,0,10,6,0,0,0-20000,3.99,https://steamcdn-a.akamaihd.net/steam/apps/538330/header.jpg?t=1533775637,https://steamcdn-a.akamaihd.net/steam/apps/538330/page_bg_generated_v6b.jpg?t=1533775637,A-Escape is an escape room game built from the ground up for VR. Will you escape in time?
23645,899760,Her 她,2018-10-16,1,橘喵喵,橘喵喵,windows,0,Single-player;Steam Achievements;Steam Cloud,Casual;Indie;Simulation,Sexual Content;Nudity;Indie,71,59,5,0,0,0-20000,2.89,https://steamcdn-a.akamaihd.net/steam/apps/899760/header.jpg?t=1541233481,https://steamcdn-a.akamaihd.net/steam/apps/899760/page_bg_generated_v6b.jpg?t=1541233481,"This is a antique style game with TCG &amp; LVG ,you need to carry out the character training of Katie (heroine) in 90 days and finish all the plots. There are 21 endings."
21207,825310,Dude Simulator 2,2018-07-27,1,Kiddy,Kiddy,windows,0,Single-player;Steam Trading Cards,Action;Adventure;Indie;Racing;Simulation,Racing;Indie;Simulation,0,195,215,12,12,20000-50000,3.99,https://steamcdn-a.akamaihd.net/steam/apps/825310/header.jpg?t=1556200533,https://steamcdn-a.akamaihd.net/steam/apps/825310/page_bg_generated_v6b.jpg?t=1556200533,Dude Simulator 2 is an open world sandbox game. This is a life simulator. The main objective is to enjoy what you are doing.
20045,791350,Favorite Miner,2018-02-06,1,IndieLip,IndieLip,windows,0,Single-player,Adventure;Casual;Indie;Simulation,Casual;Adventure;Indie,0,22,36,13,13,20000-50000,2.89,https://steamcdn-a.akamaihd.net/steam/apps/791350/header.jpg?t=1517929519,https://steamcdn-a.akamaihd.net/steam/apps/791350/page_bg_generated_v6b.jpg?t=1517929519,Favorite Miner is another 2D platformer with elements of survival in which you have to pass a variety of levels playing for a digger.
7927,436530,Bullshot,2016-11-22,1,GATO STUDIO,GATO STUDIO,windows;mac;linux,0,Single-player;Multi-player;Online Multi-Player;Local Multi-Player;Shared/Split Screen;Steam Achievements;Full controller support;Steam Trading Cards;Steam Cloud,Action;Indie,Indie;Action;Retro,42,211,61,0,0,20000-50000,0.79,https://steamcdn-a.akamaihd.net/steam/apps/436530/header.jpg?t=1538650998,https://steamcdn-a.akamaihd.net/steam/apps/436530/page_bg_generated_v6b.jpg?t=1538650998,"Help Frank F. Franky fight the evil cardesians, zombies &amp; robots while setting your arrested friends free. Bullshot is a run 'n gun game that tries to recover the essence of the 90s classics, such as Abuse, Contra or the Metal Slug sagas."
21916,848090,BATTER BURST,2018-05-07,1,TEAM_ETS,TEAM_ETS,windows,0,Single-player,Action;Indie,Action;Indie,13,1,0,0,0,0-20000,2.09,https://steamcdn-a.akamaihd.net/steam/apps/848090/header.jpg?t=1525685711,https://steamcdn-a.akamaihd.net/steam/apps/848090/page_bg_generated_v6b.jpg?t=1525685711,This game is a scroll action of continuous explosion drawn with pixel art. Let's blow it all away.
23511,895550,Total 15,2018-08-10,1,Softwaves Mini,Softwaves Dist.,windows,0,Single-player,Casual;Indie,Indie;Casual,0,1,7,0,0,0-20000,0.79,https://steamcdn-a.akamaihd.net/steam/apps/895550/header.jpg?t=1533919313,https://steamcdn-a.akamaihd.net/steam/apps/895550/page_bg_generated_v6b.jpg?t=1533919313,Challenge your problem-solving skills in this game.
9099,468820,Titans of Space PLUS,2016-05-23,1,DrashVR LLC,DrashVR LLC,windows,0,Single-player,Adventure;Casual;Simulation;Early Access,Early Access;Simulation;Adventure,0,133,9,0,0,0-20000,5.59,https://steamcdn-a.akamaihd.net/steam/apps/468820/header.jpg?t=1556327877,https://steamcdn-a.akamaihd.net/steam/apps/468820/page_bg_generated_v6b.jpg?t=1556327877,"Hang on to your cockpit seat! Go for a ride through this holographic miniature Solar System, and then squint your eyes in the intense light of a few of the largest known stars. Enjoy curated photos and facts along the way, at your own pace. Great care has been taken to ensure a comfortable VR experience."
19379,772740,Bouncers,2018-05-01,1,Cersgame Studios,Firehawk Studios,windows,0,Single-player;Steam Achievements,Casual;Indie;Racing,Indie;Casual;Racing,38,50,29,0,0,0-20000,0.79,https://steamcdn-a.akamaihd.net/steam/apps/772740/header.jpg?t=1529494867,https://steamcdn-a.akamaihd.net/steam/apps/772740/page_bg_generated_v6b.jpg?t=1529494867,"Those who love platform games may think this is a simple game, but hardest platformers ever made. This game was never for those looking for &quot;easy peasy lemon squeezy&quot;. Minimalistic platformer with colorful graphics."
26610,1027990,Antenna Dilemma,2019-04-24,1,Goloso Games,Goloso Games,windows,0,Single-player;Steam Achievements,Adventure;Indie,Adventure;Indie;Point & Click,10,15,1,0,0,0-20000,0.0,https://steamcdn-a.akamaihd.net/steam/apps/1027990/header.jpg?t=1556229499,https://steamcdn-a.akamaihd.net/steam/apps/1027990/page_bg_generated_v6b.jpg?t=1556229499,"Antenna Dilemma is a short and witty point&amp;click in which you'll follow the story of C432632, a finicky grey cube that sure doesn't want to miss his favorite TV show."
3731,317730,REVERSE SIDE,2015-07-30,1,REEW GAMES,REEW GAMES,windows,0,Single-player;Steam Achievements,Action;Adventure;Indie;Simulation;Early Access,Early Access;Space;Adventure,11,37,54,0,0,0-20000,10.59,https://steamcdn-a.akamaihd.net/steam/apps/317730/header.jpg?t=1518396894,https://steamcdn-a.akamaihd.net/steam/apps/317730/page_bg_generated_v6b.jpg?t=1518396894,"Immerse yourself into the strange and unpredictable world on the other side of the moon. Gregory Klimov is the only surviving member of his ship the Junior 2, which has crashed. He now must fight for his survival."
